question;choice1;choice2;choice3;choice4;answer
Who discovered the law of universal gravitation in the 17th century?;Albert Einstein;Isaac Newton;Galileo Galilei;Johannes Kepler;Isaac Newton
What was Alexander Fleming's important discovery in 1928?;Aspirin;Penicillin;Vaccine;Antibiotics;Penicillin
Who first proposed the heliocentric theory of astronomy?;Galileo Galilei;Nicolaus Copernicus;Isaac Newton;Albert Einstein;Nicolaus Copernicus
Which discovery made Thomas Edison famous in the late 19th century?;Telephone;Television;Radio;Electric bulb;Electric bulb
Who discovered radioactivity in 1896?;Marie Curie;Henri Becquerel;James Chadwick;Ernest Rutherford;Henri Becquerel
