question;choice1;choice2;choice3;choice4;answer
Apa nama senyawa anorganik yang sering digunakan sebagai pupuk untuk menyuplai nitrogen ke tanaman?;Amonium nitrat;Kalsium fosfat;Kalium sulfat;Natrium nitrat;Amonium nitrat
Berapa jumlah atom oksigen dalam molekul kalium nitrat (KNO3) yang digunakan sebagai pupuk?;3;4;5;6;3
Apa nama unsur kimia yang terkandung dalam kapur pertanian (CaCO3) yang digunakan untuk menetralkan keasaman tanah?;Kalium;Kalsium;Magnesium;Natrium;Kalsium
Berapa jumlah atom nitrogen dalam molekul amonium sulfat ((NH4)2SO4) yang sering digunakan sebagai pupuk?;1;2;3;4;2
Apa nama senyawa yang digunakan untuk meningkatkan kadar kalium dalam tanah pertanian?;Kalium klorida;Kalsium nitrat;Amonium sulfat;Kalium nitrat;Kalium nitrat
